{
  "schema_version": "1.1.1",
  "id": "FAQ-DATASET-001",
  "version": "1.1.0",
  "shop_id": "SHOP-DEMO-001",
  "review_status": "approved",
  "lifecycle": "draft",
  "items": [
    {
      "id": "FAQ-001",
      "version": "1.1.0",
      "question": "无理由退货的七天从哪一刻开始算？",
      "paraphrases": [
        "是购买后七天还是收货后七天？",
        "正好在签收七天的截止时刻申请可以吗？"
      ],
      "answer": "青屿示例店的无理由退货时间条件从有证据的签收时刻起算连续7×24小时，申请时刻不晚于截止时刻，恰好在截止边界也包含在内。尚未签收或签收、申请时刻缺失时，不能确定窗口，尤其不能凭购买日计算。满足七日窗口只是时间条件，还要共同满足相应品类政策；定制商品仍不支持无理由退货。 超出七日正常窗口后可生成交接摘要供人工裁量；最终是否受理未知，不能保证可退，也不能仅因超期断言人工必然拒绝。",
      "applicability": {
        "category_ids": [
          "apparel_footwear",
          "digital_accessories",
          "customized"
        ],
        "conditions": [
          {
            "field": "return_reason",
            "op": "eq",
            "value": "no_reason"
          }
        ],
        "effective_from": "2026-01-01T00:00:00+08:00",
        "effective_until": null,
        "selection_event": "purchased_at"
      },
      "answer_parameters": {
        "no_reason_window_days": 7,
        "late_application_action": "manual_review"
      },
      "evidence_refs": [
        {
          "kind": "policy_rule",
          "id": "RULE-GEN-001",
          "version": "1.0.1"
        },
        {
          "kind": "policy_rule",
          "id": "RULE-CUS-001",
          "version": "1.0.0"
        },
        {
          "kind": "policy_rule",
          "id": "RULE-GEN-003",
          "version": "1.0.1"
        }
      ],
      "review_status": "approved",
      "lifecycle": "draft"
    },
    {
      "id": "FAQ-002",
      "version": "1.0.0",
      "question": "质量问题的三十天怎么判断，说有问题就能退吗？",
      "paraphrases": [
        "质量退换和七天无理由一样吗？",
        "签收三十天内反馈质量问题是否一定能退？"
      ],
      "answer": "质量窗口从有证据的签收时刻起算连续30×24小时，以售后申请时刻不晚于截止时刻判断，含截止边界。质量仅被报告为reported不等于已核实的confirmed；窗口内申请且质量已核实，还要结合对应品类质量条款判断。超过三十日需人工裁量，时间证据缺失时先查证，不自动接受或拒绝。该规则只是虚构店铺演示约定，不主张真实法律期限。",
      "applicability": {
        "category_ids": [
          "apparel_footwear",
          "digital_accessories",
          "customized"
        ],
        "conditions": [
          {
            "field": "return_reason",
            "op": "eq",
            "value": "quality"
          }
        ],
        "effective_from": "2026-01-01T00:00:00+08:00",
        "effective_until": null,
        "selection_event": "purchased_at"
      },
      "answer_parameters": {
        "quality_window_days": 30,
        "quality_confirmation_required": true
      },
      "evidence_refs": [
        {
          "kind": "policy_rule",
          "id": "RULE-GEN-002",
          "version": "1.0.1"
        },
        {
          "kind": "policy_rule",
          "id": "RULE-APP-004",
          "version": "1.0.0"
        },
        {
          "kind": "policy_rule",
          "id": "RULE-DIG-003",
          "version": "1.0.0"
        },
        {
          "kind": "policy_rule",
          "id": "RULE-CUS-002",
          "version": "1.0.0"
        }
      ],
      "review_status": "approved",
      "lifecycle": "draft"
    },
    {
      "id": "FAQ-003",
      "version": "1.0.0",
      "question": "你能直接退款、取消订单或者帮我改价吗？",
      "paraphrases": [
        "马上替我操作退款吧。",
        "转人工之后是不是已经有人接手？"
      ],
      "answer": "本演示系统只查询、估算和解释，不执行退款、取消订单、改价等交易写操作。需要人工裁量时只能生成交接摘要；没有接入真实人工工单平台，不得说人工已经接手，也不能承诺处理或到账期限。政策条件满足不等于系统已经执行操作。",
      "applicability": {
        "category_ids": [
          "apparel_footwear",
          "digital_accessories",
          "customized"
        ],
        "conditions": [],
        "effective_from": "2026-01-01T00:00:00+08:00",
        "effective_until": null,
        "selection_event": "purchased_at"
      },
      "answer_parameters": {
        "scope": "read_only"
      },
      "evidence_refs": [
        {
          "kind": "policy_rule",
          "id": "RULE-GEN-003",
          "version": "1.0.1"
        }
      ],
      "review_status": "approved",
      "lifecycle": "draft"
    },
    {
      "id": "FAQ-004",
      "version": "1.0.0",
      "question": "鞋服吊牌、商品、包装都完整，也没在室外用过，可以无理由退吗？",
      "paraphrases": [
        "没穿出门且吊牌鞋盒都在能退吗？",
        "商品完好、吊牌包装齐全的鞋服怎么判断？"
      ],
      "answer": "在无理由退货、吊牌完整、商品完整、未在室外使用、包装完整均已确认，且申请满足签收起7×24小时窗口的前提下，符合本店鞋服无理由退货条件。窗口包含截止边界，不能改用购买日计算。任何必要条件未知时不能保证可退；运费、关联赠品及退款金额还需依各自政策和订单证据说明，本系统不会执行退款。",
      "applicability": {
        "category_ids": [
          "apparel_footwear"
        ],
        "conditions": [
          {
            "field": "return_reason",
            "op": "eq",
            "value": "no_reason"
          },
          {
            "field": "tags_intact",
            "op": "eq",
            "value": true
          },
          {
            "field": "product_intact",
            "op": "eq",
            "value": true
          },
          {
            "field": "used_outdoors",
            "op": "eq",
            "value": false
          },
          {
            "field": "packaging_intact",
            "op": "eq",
            "value": true
          },
          {
            "field": "within_no_reason_window",
            "op": "eq",
            "value": true
          }
        ],
        "effective_from": "2026-01-01T00:00:00+08:00",
        "effective_until": null,
        "selection_event": "purchased_at"
      },
      "answer_parameters": {
        "eligibility": "eligible",
        "no_reason_window_days": 7
      },
      "evidence_refs": [
        {
          "kind": "policy_rule",
          "id": "RULE-APP-001",
          "version": "1.0.0"
        },
        {
          "kind": "policy_rule",
          "id": "RULE-GEN-001",
          "version": "1.0.1"
        },
        {
          "kind": "policy_rule",
          "id": "RULE-GEN-003",
          "version": "1.0.1"
        }
      ],
      "review_status": "approved",
      "lifecycle": "draft"
    },
    {
      "id": "FAQ-005",
      "version": "1.0.0",
      "question": "衣服的吊牌已经剪掉，还能无理由退货吗？",
      "paraphrases": [
        "吊牌丢了但还在七天内能退吗？",
        "没穿过但吊牌不完整可以直接退吗？"
      ],
      "answer": "鞋服无理由退货且吊牌不完整时，不符合该品类的无理由退货条件，七日内申请不能覆盖吊牌限制。本结论仅限无理由退货；若是已核实且在三十日质量窗口内的质量问题，应另按质量例外判断，不能因吊牌缺失直接阻断。",
      "applicability": {
        "category_ids": [
          "apparel_footwear"
        ],
        "conditions": [
          {
            "field": "return_reason",
            "op": "eq",
            "value": "no_reason"
          },
          {
            "field": "tags_intact",
            "op": "eq",
            "value": false
          }
        ],
        "effective_from": "2026-01-01T00:00:00+08:00",
        "effective_until": null,
        "selection_event": "purchased_at"
      },
      "answer_parameters": {
        "eligibility": "ineligible"
      },
      "evidence_refs": [
        {
          "kind": "policy_rule",
          "id": "RULE-APP-002",
          "version": "1.0.0"
        },
        {
          "kind": "policy_rule",
          "id": "RULE-APP-004",
          "version": "1.0.0"
        },
        {
          "kind": "policy_rule",
          "id": "RULE-GEN-002",
          "version": "1.0.1"
        }
      ],
      "review_status": "approved",
      "lifecycle": "draft"
    },
    {
      "id": "FAQ-006",
      "version": "1.0.0",
      "question": "鞋盒扔了，但吊牌和鞋完整、没穿出门，能无理由退吗？",
      "paraphrases": [
        "包装缺了，其他状态完整是不是一律不能退？",
        "没鞋盒是不是会自动扣包装费？"
      ],
      "answer": "无理由退货在签收起七日窗口内，包装不完整但吊牌完整、商品完整且未在室外使用时，需要人工判断。不能直接保证可退，也不能因为没有鞋盒一律拒绝；不得自动扣包装费或给出自动扣款金额。本系统只能整理交接摘要，不能声称人工已经接手。",
      "applicability": {
        "category_ids": [
          "apparel_footwear"
        ],
        "conditions": [
          {
            "field": "return_reason",
            "op": "eq",
            "value": "no_reason"
          },
          {
            "field": "packaging_intact",
            "op": "eq",
            "value": false
          },
          {
            "field": "tags_intact",
            "op": "eq",
            "value": true
          },
          {
            "field": "product_intact",
            "op": "eq",
            "value": true
          },
          {
            "field": "used_outdoors",
            "op": "eq",
            "value": false
          },
          {
            "field": "within_no_reason_window",
            "op": "eq",
            "value": true
          }
        ],
        "effective_from": "2026-01-01T00:00:00+08:00",
        "effective_until": null,
        "selection_event": "purchased_at"
      },
      "answer_parameters": {
        "eligibility": "manual_review",
        "no_reason_window_days": 7
      },
      "evidence_refs": [
        {
          "kind": "policy_rule",
          "id": "RULE-APP-003",
          "version": "1.0.0"
        },
        {
          "kind": "policy_rule",
          "id": "RULE-GEN-001",
          "version": "1.0.1"
        },
        {
          "kind": "policy_rule",
          "id": "RULE-GEN-003",
          "version": "1.0.1"
        }
      ],
      "review_status": "approved",
      "lifecycle": "draft"
    },
    {
      "id": "FAQ-007",
      "version": "1.0.0",
      "question": "鞋服质量问题已核实且在三十日窗口内，缺鞋盒或吊牌还能退换吗？",
      "paraphrases": [
        "已经确认的质量问题会被缺吊牌挡住吗？",
        "质量退换也必须鞋盒完整吗？"
      ],
      "answer": "质量问题已核实为confirmed，并有签收、申请时刻证据确认在签收起30×24小时窗口内时，符合鞋服质量退换条件；缺鞋盒或吊牌不完整不阻断这个质量例外。窗口包含截止边界，不能用购买日计算。仅有reported不适用这一结论，超过三十日需人工裁量；可退换也不等于已执行退款或确定金额。",
      "applicability": {
        "category_ids": [
          "apparel_footwear"
        ],
        "conditions": [
          {
            "field": "return_reason",
            "op": "eq",
            "value": "quality"
          },
          {
            "field": "quality_status",
            "op": "eq",
            "value": "confirmed"
          },
          {
            "field": "within_quality_window",
            "op": "eq",
            "value": true
          }
        ],
        "effective_from": "2026-01-01T00:00:00+08:00",
        "effective_until": null,
        "selection_event": "purchased_at"
      },